{
  "schemaVersion": 1,
  "checkedAt": "2026-09-02T00:00:00Z",
  "program": "HON-201",
  "capabilityKey": "BOUND-3",
  "lastReviewedAt": "2026-09-02",
  "refresh": {
    "cadenceDays": 14,
    "mode": "reviewed_diff",
    "doesNotMutateClassifications": true
  },
  "pins": {
    "server": {
      "repository": "github:46755185",
      "tag": "v2026.6.1",
      "commit": "a09c7edb03ae6d4fdece784f1250c67be73d5fe0"
    },
    "web": {
      "repository": "github:53538899",
      "tag": "web-v2026.6.1",
      "commit": "39f07436ca60e3f25eac47777671754f288a98f1"
    },
    "browser": {
      "repository": "github:53538899",
      "tag": "browser-v2026.6.1",
      "commit": "723c075bf8b9f45c901e56195be8e94e43ed75a2"
    },
    "cli": {
      "repository": "github:53538899",
      "tag": "cli-v2026.6.0",
      "commit": "e6293ff2bc85123e9baaa998cf1543030ec5d9f0"
    }
  },
  "entries": [
    {
      "lastReviewedAt": "2026-09-02",
      "evidenceLevel": "local_api",
      "evidence": ["test/app.test.ts"],
      "supportClaim": true,
      "id": "operator.health",
      "kind": "route",
      "classification": "implemented",
      "requirementKind": "operator",
      "ownerIssue": "HON-201",
      "rationale": "HonoWarden operator health and root surfaces are not official-client protocol routes.",
      "covers": [
        {
          "method": "GET",
          "path": "/"
        },
        {
          "method": "GET",
          "path": "/health"
        },
        {
          "method": "GET",
          "path": "/healthz"
        },
        {
          "method": "GET",
          "path": "/health/db"
        }
      ]
    },
    {
      "lastReviewedAt": "2026-09-02",
      "evidenceLevel": "live_smoke",
      "evidence": [
        "compat/fixtures/config/server-config-success.json",
        "docs/release/browser-extension-live-client-evidence.md"
      ],
      "supportClaim": true,
      "id": "protocol.config",
      "kind": "route",
      "classification": "implemented",
      "requirementKind": "protocol",
      "ownerIssue": "HON-201",
      "sourcePin": {
        "repository": "github:46755185",
        "tag": "v2026.6.1",
        "commit": "a09c7edb03ae6d4fdece784f1250c67be73d5fe0",
        "path": "src/Api/Controllers/ConfigController.cs"
      },
      "covers": [
        {
          "method": "GET",
          "path": "/api/config"
        },
        {
          "method": "GET",
          "path": "/config"
        }
      ],
      "officialIds": ["official.config.get"]
    },
    {
      "lastReviewedAt": "2026-09-02",
      "evidenceLevel": "live_smoke",
      "evidence": ["docs/release/desktop-notification-transport-evidence.md"],
      "supportClaim": true,
      "id": "protocol.notifications",
      "kind": "route",
      "classification": "implemented",
      "requirementKind": "protocol",
      "ownerIssue": "HON-201",
      "sourcePin": {
        "repository": "github:46755185",
        "tag": "v2026.6.1",
        "commit": "a09c7edb03ae6d4fdece784f1250c67be73d5fe0",
        "path": "src/Notifications/Controllers/SendController.cs"
      },
      "covers": [
        {
          "method": "GET",
          "path": "/notifications/hub"
        },
        {
          "method": "GET",
          "path": "/notifications/anonymous-hub"
        }
      ],
      "runtimeFlags": ["HONOWARDEN_DURABLE_NOTIFICATIONS_ENABLED"],
      "adrs": ["0008-login-with-device-scope.md"]
    },
    {
      "lastReviewedAt": "2026-09-02",
      "evidenceLevel": "live_smoke",
      "evidence": [
        "compat/fixtures/prelogin/pbkdf2.json",
        "docs/release/browser-extension-live-client-evidence.md"
      ],
      "supportClaim": true,
      "id": "protocol.prelogin",
      "kind": "route",
      "classification": "implemented",
      "requirementKind": "protocol",
      "ownerIssue": "HON-201",
      "sourcePin": {
        "repository": "github:46755185",
        "tag": "v2026.6.1",
        "commit": "a09c7edb03ae6d4fdece784f1250c67be73d5fe0",
        "path": "src/Identity/Controllers/AccountsController.cs"
      },
      "covers": [
        {
          "method": "POST",
          "path": "/identity/accounts/prelogin"
        },
        {
          "method": "POST",
          "path": "/identity/accounts/prelogin/password"
        }
      ]
    },
    {
      "lastReviewedAt": "2026-10-04",
      "evidenceLevel": "local_api",
      "evidence": [
        "src/email-verification-routes.ts",
        "src/domain/email-verification.ts",
        "src/email-verification.ts",
        "src/repositories/email-verification-repository.ts",
        "test/email-verification-routes.test.ts",
        "test/domain/email-verification.test.ts",
        "test/email-verification-network.test.ts",
        "test/email-verification-service.test.ts",
        "test/integration/email-verification-d1.test.ts"
      ],
      "supportClaim": false,
      "id": "email_verification.evp_relying_party",
      "kind": "route",
      "classification": "implemented",
      "requirementKind": "optional_integration",
      "ownerIssue": "HON-201",
      "rationale": "Experimental strict relying-party subset of the individual Internet-Draft draft-hardt-email-verification-02, not an RFC or an upstream client protocol requirement. Authenticated current-account email proof is bound to the current refresh family, security stamp, audience, nonce, and reviewed issuer trust. It changes persisted email verification metadata only, with no login, MFA, organization, or key authority. Synthetic local evidence does not prove actual browser/issuer interoperability or deployment.",
      "honowardenBehavior": "501 unsupported_feature while disabled; fail-closed 503 for invalid runtime trust configuration or issuer infrastructure failure; verified account email only after atomic consume, metadata update, and required audit.",
      "covers": [
        {
          "method": "POST",
          "path": "/identity/accounts/email-verification/challenge"
        },
        {
          "method": "POST",
          "path": "/identity/accounts/email-verification/verify"
        }
      ],
      "runtimeFlags": ["HONOWARDEN_EMAIL_VERIFICATION_ENABLED"],
      "migrations": ["0031_email_verification.sql"],
      "adrs": ["0017-email-verification-protocol.md"]
    },
    {
      "lastReviewedAt": "2026-09-02",
      "evidenceLevel": "live_smoke",
      "evidence": [
        "compat/fixtures/token/password-grant-success.json",
        "docs/release/browser-extension-live-client-evidence.md"
      ],
      "supportClaim": true,
      "id": "protocol.token",
      "kind": "route",
      "classification": "implemented",
      "requirementKind": "protocol",
      "ownerIssue": "HON-201",
      "sourcePin": {
        "repository": "github:46755185",
        "tag": "v2026.6.1",
        "commit": "a09c7edb03ae6d4fdece784f1250c67be73d5fe0",
        "path": "src/Identity/IdentityServer/RequestValidators/ResourceOwnerPasswordValidator.cs"
      },
      "covers": [
        {
          "method": "POST",
          "path": "/identity/connect/token"
        }
      ]
    },
    {
      "lastReviewedAt": "2026-09-02",
      "evidenceLevel": "live_smoke",
      "evidence": [
        "compat/fixtures/sync/empty-personal-vault.json",
        "docs/release/browser-extension-live-client-evidence.md"
      ],
      "supportClaim": true,
      "id": "protocol.sync",
      "kind": "route",
      "classification": "implemented",
      "requirementKind": "protocol",
      "ownerIssue": "HON-201",
      "sourcePin": {
        "repository": "github:46755185",
        "tag": "v2026.6.1",
        "commit": "a09c7edb03ae6d4fdece784f1250c67be73d5fe0",
        "path": "src/Api/Vault/Controllers/SyncController.cs"
      },
      "covers": [
        {
          "method": "GET",
          "path": "/api/sync"
        }
      ],
      "officialIds": ["official.sync.get"]
    },
    {
      "lastReviewedAt": "2026-09-02",
      "evidenceLevel": "live_smoke",
      "evidence": [
        "compat/fixtures/accounts/profile-success.json",
        "docs/release/browser-extension-live-client-evidence.md"
      ],
      "supportClaim": true,
      "id": "accounts.profile",
      "kind": "route",
      "classification": "implemented",
      "requirementKind": "protocol",
      "ownerIssue": "HON-201",
      "sourcePin": {
        "repository": "github:46755185",
        "tag": "v2026.6.1",
        "commit": "a09c7edb03ae6d4fdece784f1250c67be73d5fe0",
        "path": "src/Api/Auth/Controllers/AccountsController.cs"
      },
      "covers": [
        {
          "method": "GET",
          "path": "/api/accounts/profile"
        },
        {
          "method": "PUT",
          "path": "/api/accounts/profile"
        },
        {
          "method": "POST",
          "path": "/api/accounts/profile"
        },
        {
          "method": "GET",
          "path": "/api/accounts/revision-date"
        }
      ]
    },
    {
      "lastReviewedAt": "2026-09-02",
      "evidenceLevel": "live_smoke",
      "evidence": ["docs/release/android-mobile-live-client-evidence.md"],
      "supportClaim": true,
      "id": "accounts.billing_stub",
      "kind": "route",
      "classification": "implemented",
      "requirementKind": "protocol",
      "ownerIssue": "HON-199",
      "sourcePin": {
        "repository": "github:46755185",
        "tag": "v2026.6.1",
        "commit": "a09c7edb03ae6d4fdece784f1250c67be73d5fe0",
        "path": "src/Api/Billing/Controllers/VNext/AccountBillingVNextController.cs"
      },
      "covers": [
        {
          "method": "GET",
          "path": "/api/account/billing/vnext/subscription"
        }
      ],
      "rationale": "Official clients read a self-hosted billing stub; this is not cloud commerce activation.",
      "roadmapAnchors": []
    },
    {
      "lastReviewedAt": "2026-09-02",
      "evidenceLevel": "local_api",
      "evidence": ["test/app.test.ts"],
      "supportClaim": false,